[
  {"id": "park-B-car", "type": "parking_car", "floor": "B", "wing": "central", "label": "Basement car parking", "capacityTotal": 40, "capacityAvailable": 35, "vehicleType": "car"},
  {"id": "park-B-bike", "type": "parking_bike", "floor": "B", "wing": "central", "label": "Basement bike parking", "capacityTotal": 100, "capacityAvailable": 82, "vehicleType": "bike"},
  {"id": "park-G-car", "type": "parking_car", "floor": "G", "wing": "central", "label": "Ground car parking", "capacityTotal": 40, "capacityAvailable": 28, "vehicleType": "car"},
  {"id": "park-G-bike", "type": "parking_bike", "floor": "G", "wing": "central", "label": "Ground bike parking", "capacityTotal": 100, "capacityAvailable": 71, "vehicleType": "bike"},
  {"id": "park-1-car", "type": "parking_car", "floor": "1", "wing": "central", "label": "1st floor car parking", "capacityTotal": 40, "capacityAvailable": 31, "vehicleType": "car"},
  {"id": "park-1-bike", "type": "parking_bike", "floor": "1", "wing": "central", "label": "1st floor bike parking", "capacityTotal": 100, "capacityAvailable": 88, "vehicleType": "bike"},
  {"id": "park-2-car", "type": "parking_car", "floor": "2", "wing": "central", "label": "2nd floor car parking", "capacityTotal": 40, "capacityAvailable": 12, "vehicleType": "car"},
  {"id": "park-2-bike", "type": "parking_bike", "floor": "2", "wing": "central", "label": "2nd floor bike parking", "capacityTotal": 100, "capacityAvailable": 67, "vehicleType": "bike"},
  {"id": "park-3-car", "type": "parking_car", "floor": "3", "wing": "central", "label": "3rd floor car parking", "capacityTotal": 40, "capacityAvailable": 22, "vehicleType": "car"},
  {"id": "park-3-bike", "type": "parking_bike", "floor": "3", "wing": "central", "label": "3rd floor bike parking", "capacityTotal": 100, "capacityAvailable": 54, "vehicleType": "bike"},
  {"id": "park-4-car", "type": "parking_car", "floor": "4", "wing": "central", "label": "4th floor car parking", "capacityTotal": 40, "capacityAvailable": 18, "vehicleType": "car"},
  {"id": "park-4-bike", "type": "parking_bike", "floor": "4", "wing": "central", "label": "4th floor bike parking", "capacityTotal": 100, "capacityAvailable": 91, "vehicleType": "bike"},
  {"id": "am-G-restroom", "type": "restroom", "floor": "G", "wing": "central", "label": "Ground floor restrooms", "venueId": "ven-G01"},
  {"id": "am-G-elevator", "type": "elevator", "floor": "G", "wing": "central", "label": "Main Elevator Bank", "venueId": "ven-G01"},
  {"id": "am-G-help", "type": "help_desk", "floor": "G", "wing": "central", "label": "Registration Help Desk", "venueId": "ven-G01"},
  {"id": "am-G-first-aid", "type": "first_aid", "floor": "G", "wing": "central", "label": "First Aid Station", "venueId": "ven-G01"},
  {"id": "am-5-garden", "type": "garden", "floor": "5", "wing": "central", "label": "Open Air Garden & Fountain"},
  {"id": "am-5-snacks", "type": "coffee", "floor": "5", "wing": "central", "label": "Wellness Snack Kiosk"},
  {"id": "am-6-elevator-n", "type": "elevator", "floor": "6", "wing": "N", "label": "North Elevator Bank", "venueId": "ven-C601"},
  {"id": "am-6-elevator-s", "type": "elevator", "floor": "6", "wing": "S", "label": "South Elevator Bank"},
  {"id": "am-6-elevator-c", "type": "elevator", "floor": "6", "wing": "central", "label": "Central Elevators"},
  {"id": "am-6-stairs", "type": "stairs", "floor": "6", "wing": "central", "label": "Central Stairs"},
  {"id": "am-6-restroom-n", "type": "restroom", "floor": "6", "wing": "N", "label": "North wing restrooms (ladies)"},
  {"id": "am-6-restroom-s", "type": "restroom", "floor": "6", "wing": "S", "label": "South wing restrooms (gents)"},
  {"id": "am-6-coffee", "type": "coffee", "floor": "6", "wing": "N", "label": "Community Cafeteria", "venueId": "ven-C601"},
  {"id": "am-6-gym", "type": "gym", "floor": "6", "wing": "S", "label": "South Wing Gym"},
  {"id": "am-6-library", "type": "library", "floor": "6", "wing": "S", "label": "South Wing Library"},
  {"id": "am-6-training", "type": "training_room", "floor": "6", "wing": "S", "label": "South Training Rooms"},
  {"id": "am-6-refresh", "type": "coffee", "floor": "6", "wing": "S", "label": "South Refresh Corner"},
  {"id": "am-7-restroom-n", "type": "restroom", "floor": "7", "wing": "N", "label": "North wing restrooms (ladies)"},
  {"id": "am-7-restroom-s", "type": "restroom", "floor": "7", "wing": "S", "label": "South wing restrooms (gents)"},
  {"id": "am-7-elevator", "type": "elevator", "floor": "7", "wing": "central", "label": "Floor 7 Central Elevators"},
  {"id": "am-7-stairs", "type": "stairs", "floor": "7", "wing": "central", "label": "Floor 7 Central Stairs"},
  {"id": "am-7-coffee-n", "type": "coffee", "floor": "7", "wing": "N", "label": "North Wing Coffee"},
  {"id": "am-7-coffee-s", "type": "coffee", "floor": "7", "wing": "S", "label": "South Wing Coffee"},
  {"id": "am-8-restroom-n", "type": "restroom", "floor": "8", "wing": "N", "label": "North wing restrooms (ladies)"},
  {"id": "am-8-restroom-s", "type": "restroom", "floor": "8", "wing": "S", "label": "South wing restrooms (gents)"},
  {"id": "am-8-elevator", "type": "elevator", "floor": "8", "wing": "central", "label": "Floor 8 Central Elevators"},
  {"id": "am-8-stairs", "type": "stairs", "floor": "8", "wing": "central", "label": "Floor 8 Central Stairs"},
  {"id": "am-8-coffee-n", "type": "coffee", "floor": "8", "wing": "N", "label": "North Wing Coffee"},
  {"id": "am-8-coffee-s", "type": "coffee", "floor": "8", "wing": "S", "label": "South Wing Coffee"},
  {"id": "am-8-mothers", "type": "mothers_room", "floor": "8", "wing": "central", "label": "Mothers Room"},
  {"id": "am-9-restroom-n", "type": "restroom", "floor": "9", "wing": "N", "label": "North wing restrooms (ladies)"},
  {"id": "am-9-restroom-s", "type": "restroom", "floor": "9", "wing": "S", "label": "South wing restrooms (gents)"},
  {"id": "am-9-elevator", "type": "elevator", "floor": "9", "wing": "central", "label": "Floor 9 Central Elevators"},
  {"id": "am-9-stairs", "type": "stairs", "floor": "9", "wing": "central", "label": "Floor 9 Central Stairs"},
  {"id": "am-9-coffee-n", "type": "coffee", "floor": "9", "wing": "N", "label": "North Wing Coffee"},
  {"id": "am-9-coffee-s", "type": "coffee", "floor": "9", "wing": "S", "label": "South Wing Coffee"},
  {"id": "am-10-restroom-n", "type": "restroom", "floor": "10", "wing": "N", "label": "North wing restrooms (ladies)"},
  {"id": "am-10-restroom-s", "type": "restroom", "floor": "10", "wing": "S", "label": "South wing restrooms (gents)"},
  {"id": "am-10-elevator", "type": "elevator", "floor": "10", "wing": "central", "label": "Floor 10 Central Elevators"},
  {"id": "am-10-stairs", "type": "stairs", "floor": "10", "wing": "central", "label": "Floor 10 Central Stairs"},
  {"id": "am-10-coffee-n", "type": "coffee", "floor": "10", "wing": "N", "label": "North Wing Coffee"},
  {"id": "am-10-coffee-s", "type": "coffee", "floor": "10", "wing": "S", "label": "South Wing Coffee"},
  {"id": "am-11-restroom-n", "type": "restroom", "floor": "11", "wing": "N", "label": "North wing restrooms (ladies)"},
  {"id": "am-11-restroom-s", "type": "restroom", "floor": "11", "wing": "S", "label": "South wing restrooms (gents)"},
  {"id": "am-11-elevator", "type": "elevator", "floor": "11", "wing": "central", "label": "Floor 11 Central Elevators"},
  {"id": "am-11-stairs", "type": "stairs", "floor": "11", "wing": "central", "label": "Floor 11 Central Stairs"},
  {"id": "am-11-coffee-n", "type": "coffee", "floor": "11", "wing": "N", "label": "North Wing Coffee"},
  {"id": "am-11-coffee-s", "type": "coffee", "floor": "11", "wing": "S", "label": "South Wing Coffee"},
  {"id": "am-12-restroom-n", "type": "restroom", "floor": "12", "wing": "N", "label": "North wing restrooms (ladies)"},
  {"id": "am-12-restroom-s", "type": "restroom", "floor": "12", "wing": "S", "label": "South wing restrooms (gents)"},
  {"id": "am-12-elevator", "type": "elevator", "floor": "12", "wing": "central", "label": "Floor 12 Central Elevators"},
  {"id": "am-12-stairs", "type": "stairs", "floor": "12", "wing": "central", "label": "Floor 12 Central Stairs"},
  {"id": "am-12-coffee-n", "type": "coffee", "floor": "12", "wing": "N", "label": "North Wing Coffee"},
  {"id": "am-12-coffee-s", "type": "coffee", "floor": "12", "wing": "S", "label": "South Wing Coffee"},
  {"id": "am-13-restroom-n", "type": "restroom", "floor": "13", "wing": "N", "label": "North wing restrooms (ladies)"},
  {"id": "am-13-restroom-s", "type": "restroom", "floor": "13", "wing": "S", "label": "South wing restrooms (gents)"},
  {"id": "am-13-elevator", "type": "elevator", "floor": "13", "wing": "central", "label": "Floor 13 Central Elevators"},
  {"id": "am-13-stairs", "type": "stairs", "floor": "13", "wing": "central", "label": "Floor 13 Central Stairs"},
  {"id": "am-13-coffee-n", "type": "coffee", "floor": "13", "wing": "N", "label": "North Wing Coffee"},
  {"id": "am-13-coffee-s", "type": "coffee", "floor": "13", "wing": "S", "label": "South Wing Coffee"},
  {"id": "am-13-quiet", "type": "quiet_zone", "floor": "13", "wing": "N", "label": "Quiet Terrace Zone"},
  {"id": "am-13-prayer", "type": "prayer_room", "floor": "13", "wing": "S", "label": "Prayer & Reflection Room"}
]
